sample_id,account_id,submitted_date,review_text_anonymized,char_count,language
SAMP-001,ACC-001,2026-01-12,[Attorney] was responsive and kept us informed throughout the entire process. Highly recommend.,91,en
SAMP-002,ACC-003,2026-01-26,The team handled our employment dispute professionally. Settlement exceeded expectations.,85,en
SAMP-003,ACC-003,2026-01-26,Communication could have been better. Took 3 days to return my call.,65,en
SAMP-004,ACC-005,2026-02-23,Outstanding estate planning work. Made a complicated process feel simple.,71,en
SAMP-005,ACC-002,2026-01-19,Helped me through a difficult divorce with patience and clarity.,60,en
